3月31日,m00000004686001,【リスティングOK!!】IKEA（イケア）の通販代行【モブライフ】販売促進プログラム（14-0204）,新生活スタートに向け、家具の需要が増加中です。
4月1日,m00000004915001,ワキ・二の腕の黒ずみ対策に【薬用アットベリー】黒ずみケアクリーム販売促進プログラム（14-0625）,夏向けオススメ商品プログラム
4月2日,m00000004915002,多汗・ニオイ専用サプリメント【asepper（アセッパー）】販売促進プログラム（14-0625）,夏向けオススメ商品プログラム
4月3日,m00000005211001,魅惑的なメリハリBodyに・・プエラリアサプリメント【B-UP（ビーアップ）】販促プログラム（14-1219）,初月は送料500円のみのバストアップサプリプログラム
4月4日,m00000004797001,脱ぎたくなる美肌 脱毛サロン【KIREIMO / キレイモ】来店促進プログラム（14-0423）,1周年記念企画開催中！！
4月5日,m00000005070001,カリスマモデルがプロデュースした【スタイルプラス骨盤ショーツ】販売促進プログラム（14-0930）,骨盤マニアのカリスマブロガーがプロデュース！
4月6日,m00000004714001,斉藤みらい初プロデュースプラセンタサプリメント【ハニーローズプラセンタ】販促プログラム（14-0227）,斉藤みらいプロデュース！！
